{
  "$schema": "./full-demo-overlay-layout.schema.json",
  "schema_version": "cliphub.full-demo-overlay-layout/v1",
  "canvas": {
    "width": 1920,
    "height": 1080
  },
  "assets": {
    "intro_chrome": {
      "renderer": "programmatic",
      "fit": "canvas",
      "requires_alpha": true,
      "art_direction": "Two symmetric five-card FACEIT roster panels; rounded graphite cards with an accent avatar ring, FACEIT level ring, and a darker stats band; POV card tinted with the theme accent; clear gameplay center"
    },
    "outro_chrome": {
      "renderer": "programmatic",
      "fit": "canvas",
      "requires_alpha": true,
      "art_direction": "Two stacked rounded FACEIT match boards; accent score chip before each team name; teal CT and violet T side stripes on the name cell; POV row tinted with the theme accent; centered stat columns"
    }
  },
  "themes": {
    "faceit-orange": {
      "accent": "0xFF5500",
      "accent_soft": "0xFF7733"
    },
    "neon-violet": {
      "accent": "0xA855F7",
      "accent_soft": "0xC084FC"
    }
  },
  "palette": {
    "text": "0xFFFFFF",
    "muted_text": "0x9A9AA3",
    "stat_text": "0xE4E4E7",
    "stat_positive": "0x4ADE80",
    "stat_negative": "0xF87171",
    "target_text": "0xFCD34D",
    "pov_fill": "0xF59E0B",
    "pov_text": "0x111111",
    "rank_fill": "0xFFD700",
    "rank_text": "0x111111",
    "level_10_fill": "0xFE1F00",
    "level_8_fill": "0xFF6309",
    "level_4_fill": "0xFFC800",
    "level_2_fill": "0x1CE400",
    "level_default_fill": "0xE5E7EB",
    "level_ring_fill": "0x101114@0.98",
    "intro_panel_fill": "0x0A0B0E@0.92",
    "intro_panel_border": "0xFFFFFF@0.10",
    "intro_card_fill": "0x16181D@0.96",
    "intro_card_border": "0xFFFFFF@0.06",
    "intro_card_divider": "0xFFFFFF@0.08",
    "intro_stats_band": "0x0B0C0F@0.92",
    "intro_texture": "0xFFFFFF@0.025",
    "avatar_fill": "0x27272A",
    "outro_backdrop": "0x020304@0.72",
    "outro_board_fill": "0x0A0B0E@0.90",
    "outro_board_border": "0xFFFFFF@0.08",
    "outro_label_fill": "0xFFFFFF@0.04",
    "outro_row_even": "0x15171C@0.92",
    "outro_row_odd": "0x0F1014@0.92",
    "outro_ct_name": "0x1E6F6B@0.38",
    "outro_ct_stripe": "0x2DD4BF",
    "outro_t_name": "0x5B3FA0@0.38",
    "outro_t_stripe": "0xA78BFA",
    "outro_divider": "0xFFFFFF@0.06"
  },
  "intro": {
    "z_order": ["chrome", "avatars", "data"],
    "panel": {
      "width": 570,
      "height": 1004,
      "top": 38,
      "left_x": 14,
      "right_x": 1336,
      "center_gap": 752,
      "row_height": 180,
      "max_players": 5,
      "header_height": 96
    },
    "header": {
      "name": { "x": 24, "y": 16, "font_size": 30 },
      "subtitle": { "x": 24, "y": 58, "font_size": 13 }
    },
    "card": { "x": 8, "y": -8, "width": 554, "height": 168 },
    "avatar": { "x": 20, "y": 10, "width": 84, "height": 84 },
    "name": { "x": 130, "y": 12, "font_size": 26 },
    "country": {
      "rect": { "x": 130, "y": 50, "width": 40, "height": 20 },
      "font_size": 11
    },
    "elo": { "right": 78, "y": 12, "font_size": 30 },
    "elo_label": { "right": 78, "y": 48, "font_size": 10 },
    "pov": {
      "rect": { "x": 178, "y": 50, "width": 46, "height": 20 },
      "font_size": 10
    },
    "level": {
      "rect": { "x": 498, "y": 10, "width": 48, "height": 48 },
      "font_size": 19
    },
    "rank": {
      "rect": { "x": 470, "y": 66, "width": 76, "height": 20 },
      "font_size": 10
    },
    "stats": {
      "x": 20,
      "band_y": 100,
      "title_y": 106,
      "value_y": 121,
      "right": 16,
      "title_size": 9,
      "value_size": 17,
      "label_size": 9,
      "label_gap": 5,
      "weights": [0.75, 0.85, 1.2, 0.85, 0.85, 1.0]
    },
    "chrome": {
      "panel_radius": 10,
      "panel_border": 1,
      "accent_width": 4,
      "header_divider": 2,
      "card_radius": 6,
      "card_accent_width": 4,
      "avatar_ring": 3,
      "level_ring": 4,
      "texture_spacing": 12
    }
  },
  "outro": {
    "z_order": ["backdrop", "chrome", "data"],
    "margin": 120,
    "header_y": 64,
    "row_y": 156,
    "row_height": 62,
    "team_y_gap": 500,
    "max_players": 5,
    "name_width": 320,
    "header": { "x": 92, "y": 0, "font_size": 28 },
    "score": {
      "rect": { "x": 0, "y": 0, "width": 74, "height": 46 },
      "font_size": 28
    },
    "team_average": { "right": 16, "y": 0, "font_size": 22 },
    "team_average_label": { "right": 16, "y": 30, "font_size": 10 },
    "map_label": { "y": 502, "font_size": 13 },
    "column_labels_y": 58,
    "column_label_size": 12,
    "stat_size": 18,
    "name": { "x": 22, "y": 0, "font_size": 18 },
    "pov_name_x": 74,
    "pov": {
      "rect": { "x": 18, "y": 21, "width": 46, "height": 20 },
      "font_size": 10
    },
    "columns": [
      { "id": "level", "label": "LVL", "x": 320, "width": 113 },
      { "id": "elo", "label": "ELO", "x": 433, "width": 113 },
      { "id": "rating", "label": "RATING", "x": 546, "width": 113 },
      { "id": "kda", "label": "K/D/A", "x": 659, "width": 113 },
      { "id": "adr", "label": "ADR", "x": 772, "width": 113 },
      { "id": "kr", "label": "K/R", "x": 885, "width": 113 },
      { "id": "hspct", "label": "HS%", "x": 998, "width": 113 },
      { "id": "5k", "label": "5K", "x": 1111, "width": 113 },
      { "id": "4k", "label": "4K", "x": 1224, "width": 113 },
      { "id": "3k", "label": "3K", "x": 1337, "width": 113 },
      { "id": "2k", "label": "2K", "x": 1450, "width": 113 },
      { "id": "mvp", "label": "MVP", "x": 1563, "width": 113 }
    ],
    "chrome": {
      "board_left": -14,
      "board_top": -18,
      "board_right": 14,
      "board_bottom": 12,
      "board_radius": 8,
      "accent_width": 5,
      "label_top": 52,
      "label_bottom": -2,
      "row_bottom_gap": 2,
      "name_right_gap": 4,
      "side_stripe_width": 4,
      "divider_height": 1
    }
  }
}
